{
  "$schema": "./schema/top.schema.json",
  "status_options": [
    { "id": "new", "label": "New" },
    { "id": "shaky", "label": "Shaky" },
    { "id": "known", "label": "Ready" }
  ],
  "method": [
    { "id": "clarify", "step": "Clarify the requirements", "minutes": "3 to 5 min", "say": "Before I draw anything: who are the users, what is peak traffic, what latency and uptime do you need, what data is involved, any compliance rules, and what is the budget?" },
    { "id": "simple-path", "step": "Draw the simplest working path", "minutes": "5 min", "say": "Here is the simplest version that works end to end: the user hits this, which calls this, which stores data here." },
    { "id": "scale", "step": "Scale it", "minutes": "5 min", "say": "To handle the peak, I add caching, auto scaling, and a queue in front of the slow work." },
    { "id": "resilient", "step": "Make it resilient", "minutes": "4 min", "say": "If an instance dies, Auto Scaling replaces it. If an AZ fails, traffic shifts and the database fails over. For a Region failure, the DR tier depends on your RPO and RTO." },
    { "id": "secure", "step": "Secure it", "minutes": "4 min", "say": "IAM roles with least privilege, apps and data in private subnets, encryption with KMS and TLS, and WAF at the edge." },
    { "id": "operate", "step": "Operate and cost it", "minutes": "3 min", "say": "CloudWatch alarms on what users feel, like latency and errors; everything in CloudFormation or CDK; right-size and use Savings Plans for steady load." },
    { "id": "tradeoff", "step": "Name one tradeoff", "minutes": "1 min", "say": "The main tradeoff I made is this, and I chose it because of your requirement for that. If the requirement changes, I would switch to this alternative." }
  ],
  "moves": [
    { "id": "vague", "situation": "The question is vague", "do": "Ask two or three questions, then state your assumptions out loud and continue. Interviewers grade the questions as much as the design.", "say": "I will assume about a million daily users, mostly in the US, and read heavy. Tell me if any of that is wrong." },
    { "id": "unknown", "situation": "You do not know a service or a number", "do": "Say so in one sentence, reason from a principle you do know, and say how you would confirm. Never invent a limit.", "say": "I have not used that directly. Based on how similar services work I would expect this, and I would confirm it in the AWS documentation before recommending it." },
    { "id": "x-or-y", "situation": "An X or Y question", "do": "Give the one-line tell first, then the condition under which the other option wins.", "say": "I would default to X because of this. Y wins when that is true." },
    { "id": "pushback", "situation": "The interviewer pushes back or adds a constraint", "do": "Treat it as a new requirement, not a sign you failed. Adjust the design and name what it costs.", "say": "Good point. With that constraint I would change this part. The cost is that, which I think is worth it because of your requirement." },
    { "id": "mistake", "situation": "You notice your own mistake", "do": "Correct it immediately and out loud. Self-correction reads as judgment.", "say": "Let me correct that: the Multi-AZ standby does not serve reads, so for read scale I would add a read replica." },
    { "id": "experience", "situation": "Asked about your AWS experience", "do": "Describe what you actually built and ran, then map the same pattern to AWS. Do not claim deployments you did not do.", "say": "In production I ran this on a different platform. On AWS I would build the same thing with these services, for this reason." },
    { "id": "time", "situation": "You are running out of time", "do": "Stop adding boxes. Summarize the design in 30 seconds and list what you would add next.", "say": "To summarize: this path, these failure protections, this security layer. With more time I would add caching here and a DR plan for the second Region." }
  ],
  "groups": [
    { "id": "design", "name": "Design scenarios", "intro": "Open-ended whiteboard prompts. Clarify first, draw the simple path, then scale, protect, and secure it." },
    { "id": "compare", "name": "X or Y comparisons", "intro": "Most technical questions are a disguised choice. Give the tell, then when the other option wins." },
    { "id": "concept", "name": "Core concepts", "intro": "Definitions you must give precisely, each with one AWS example." },
    { "id": "troubleshoot", "name": "Troubleshoot and optimize", "intro": "Show a method: measure first, then fix the bottleneck you found." },
    { "id": "customer", "name": "Customer conversations", "intro": "Where technical depth meets Leadership Principles. Have a real story ready for each." }
  ],
  "priorities": [
    { "id": "P0", "name": "Top priority: drill daily" },
    { "id": "P1", "name": "Next: once P0 is easy" }
  ],
  "questions": [
    {
      "id": "ha-web", "group": "design", "priority": "P0",
      "q": "Design a highly available, scalable web application on AWS.",
      "tests": "Whether you start from requirements, know the standard three-tier layout, and can say what fails and how it recovers.",
      "ask_first": ["Who are the users and where are they? What is peak traffic compared with normal?", "What latency and availability target, for example 99.9 or 99.99 percent?", "Is the data relational? Any compliance or data residency rules?", "Budget and team size: who will operate it?"],
      "answer": [
        "Edge: Route 53 for DNS, CloudFront in front for static assets and caching, with WAF attached to block common web attacks.",
        "App tier: an Application Load Balancer across at least two Availability Zones, with targets in an Auto Scaling group or ECS on Fargate in private subnets. Scale on request count or latency, not only CPU.",
        "Keep the app stateless: sessions live in ElastiCache or DynamoDB, so any instance can serve any user and scaling in loses nothing.",
        "Data: Aurora or RDS Multi-AZ in private data subnets for automatic failover; add read replicas or ElastiCache when reads grow.",
        "Security and operations: IAM roles, Secrets Manager for database credentials, KMS encryption, CloudWatch alarms on latency and 5xx errors, and everything defined in CloudFormation or CDK."
      ],
      "handle": ["Spend the first minute on questions, then draw the simplest path from user to data before adding anything.", "Narrate failure: an instance dies and the Auto Scaling group replaces it; an AZ fails and the ALB routes to the other AZ while the database fails over to its standby.", "Close with one tradeoff, for example Fargate over EC2 for less operations at a somewhat higher unit cost."],
      "followups": [
        { "q": "What if an entire Region goes down?", "a": "Multi-AZ does not cover that. Pick a DR tier from the RPO and RTO: pilot light or warm standby in a second Region, Aurora Global Database or cross-Region replicas, and Route 53 failover records." },
        { "q": "The database is the bottleneck. What next?", "a": "Find out whether it is reads or writes. Reads: ElastiCache and read replicas. Writes: tune queries and indexes, scale the instance up, then consider sharding or moving key-value access patterns to DynamoDB." }
      ],
      "trap": "Putting the app or database in public subnets, or claiming Multi-AZ scales reads.",
      "link": { "href": "architecture.html#pattern-ha-web", "label": "Trace the HA web app diagram" }
    },
    {
      "id": "scale-millions", "group": "design", "priority": "P0",
      "q": "How would you scale an application from a hundred users to ten million?",
      "tests": "Whether you evolve a design step by step and fix the real bottleneck instead of jumping straight to the final architecture.",
      "ask_first": ["Read heavy or write heavy?", "Where are the users?", "Which parts are static files and which are dynamic?"],
      "answer": [
        "Stage 1, one server: EC2 plus a database. Simple, but one failure takes everything down.",
        "Stage 2, scale out: an ALB in front, instances in an Auto Scaling group across two or more AZs, and the database on RDS Multi-AZ.",
        "Stage 3, go stateless: move sessions off the servers into ElastiCache or DynamoDB. Sticky sessions work short term but unbalance load and lose sessions when an instance dies.",
        "Stage 4, offload reads: ElastiCache for hot data, read replicas for reporting, S3 plus CloudFront for images and static files.",
        "Stage 5, decouple and specialize: SQS between the web tier and slow background work, DynamoDB for high-scale key-value access, and a second Region only when latency or DR requires it."
      ],
      "handle": ["At each stage, say which limit forced the change: single point of failure, then CPU, then session state, then database reads.", "Label any numbers as assumptions.", "Keep one diagram and add to it instead of redrawing."],
      "followups": [
        { "q": "Why not start with the final architecture?", "a": "Cost and complexity. Every component adds spend and operations, so I add each one when a measured bottleneck justifies it. That is the Cost Optimization and Operational Excellence pillars in practice." },
        { "q": "Sticky sessions or a session store?", "a": "A session store. Stickiness ties a user to one instance, so load becomes uneven and a terminated instance logs users out. ElastiCache or DynamoDB keeps instances interchangeable." }
      ],
      "trap": "Jumping to microservices and Kubernetes without saying which problem each piece solves.",
      "link": { "href": "architecture.html#pattern-ha-web", "label": "Start from the HA web app diagram" }
    },
    {
      "id": "dr", "group": "design", "priority": "P0",
      "q": "A customer needs disaster recovery for a critical application. How do you design it?",
      "tests": "Whether you anchor on RPO, RTO, and cost instead of defaulting to active-active.",